{
  "id": "shelf-bracket",
  "name": "Shelf bracket",
  "alternativeNames": "Shelf brace, triangular bracket, cantilever shelf support, wall shelf bracket",
  "description": "Right-triangle shelf support: vertical wall leg, horizontal shelf leg at the top, and a diagonal brace running from the foot of the wall leg up to the tip of the shelf leg. With the lightening cutout on, the bracket prints as a three-bar frame (wall + shelf + brace). Print on its side (one triangular face on the bed) so layer lines run along the load path — the bracket width becomes the print height.",
  "thumbnail": "thumbnails/shelf-bracket.png",
  "category": "shelf",
  "version": "1.1.0",
  "generationStrategy": "shelfBracket",
  "units": "mm",
  "parameters": [
    {
      "key": "wallLegHeight",
      "label": "Wall leg height",
      "description": "Height of the vertical leg that screws to the wall (along Z). Taller wall legs spread mounting forces over more screws and reduce wall-anchor pull-out.",
      "type": "number",
      "default": 80,
      "min": 30,
      "max": 250,
      "step": 0.5,
      "group": "dimensions",
      "unit": "mm"
    },
    {
      "key": "shelfLegLength",
      "label": "Shelf leg length",
      "description": "Length of the horizontal leg the shelf board rests on (along X, from the wall outward). Often slightly less than the shelf board depth so the bracket is hidden.",
      "type": "number",
      "default": 100,
      "min": 30,
      "max": 250,
      "step": 0.5,
      "group": "dimensions",
      "unit": "mm"
    },
    {
      "key": "width",
      "label": "Bracket width",
      "description": "Depth of the bracket along Y — how thick the bracket appears when viewed from the front. Becomes the print height when laid flat on the side. Wider = stiffer but uses more filament and prints taller.",
      "type": "number",
      "default": 12,
      "min": 6,
      "max": 40,
      "step": 0.5,
      "group": "dimensions",
      "unit": "mm"
    },
    {
      "key": "legThickness",
      "label": "Leg / brace thickness",
      "description": "Wall thickness of the wall leg, shelf leg, and diagonal brace (all three share one thickness so the frame prints evenly). Opinionated: a separate brace thickness is not exposed because mismatched bar thicknesses create stress concentrations at the joints.",
      "type": "number",
      "default": 4,
      "min": 2.4,
      "max": 8,
      "step": 0.1,
      "group": "dimensions",
      "unit": "mm"
    },
    {
      "key": "style",
      "label": "Bracket style",
      "description": "Triangular = full diagonal brace from the foot of the wall leg to the tip of the shelf leg (load-bearing). L-shaped = no brace, just the two legs (light loads only).",
      "type": "select",
      "default": "triangular",
      "group": "dimensions",
      "options": [
        { "value": "triangular", "label": "Triangular (braced)" },
        { "value": "l-shaped", "label": "L-shaped (no brace)" }
      ]
    },
    {
      "key": "lighteningCutout",
      "label": "Lightening cutout in brace",
      "description": "Removes the inner triangle between the three bars so the bracket prints as an open frame — saves filament with little stiffness loss (the three perimeter bars carry the load). Disable for maximum strength or a solid-infill aesthetic. Ignored when style = L-shaped.",
      "type": "boolean",
      "default": true,
      "group": "reinforcement"
    },
    {
      "key": "holeDiameter",
      "label": "Hole diameter",
      "description": "Used when \"Custom\" bolt size is selected in the mounting section. Same diameter for wall and shelf holes.",
      "type": "number",
      "default": 4.5,
      "min": 2,
      "max": 10,
      "step": 0.1,
      "group": "hardware",
      "unit": "mm"
    },
    {
      "key": "wallHoleCount",
      "label": "Wall mounting holes",
      "description": "Through-holes along the wall leg for screws into the wall (drywall anchors, masonry plugs, or studs). Placed below the shelf leg so screw heads sit flush against the wall.",
      "type": "integer",
      "default": 2,
      "min": 1,
      "max": 5,
      "group": "hardware"
    },
    {
      "key": "shelfHoleCount",
      "label": "Shelf mounting holes",
      "description": "Through-holes down through the shelf leg for screws into the underside of the shelf board. Set 0 to omit (rely on the shelf's weight or tape/adhesive).",
      "type": "integer",
      "default": 2,
      "min": 0,
      "max": 5,
      "group": "hardware"
    },
    {
      "key": "edgeOffset",
      "label": "Hole edge offset",
      "description": "Inset from each leg's free end for the first/last hole centre (also used as the wall-side inset on the shelf leg).",
      "type": "number",
      "default": 10,
      "min": 3,
      "max": 40,
      "step": 0.5,
      "group": "hardware",
      "unit": "mm"
    },
    {
      "key": "wallHoleCountersunk",
      "label": "Countersink wall holes",
      "description": "Conical recess on the wall-facing side of the wall leg so flat-head screw heads sit flush against the wall. Countersink angle follows bolt preset (90° metric, 82° UNC).",
      "type": "boolean",
      "default": true,
      "group": "hardware"
    },
    {
      "key": "screwAccessSlots",
      "label": "Screw-access slots through brace",
      "description": "Adds a small vertical slot through the brace web above each shelf-leg hole so a screwdriver can reach through to drive the shelf screw. Only has an effect when the bracket is triangular AND the lightening cutout is off (otherwise the brace is already an open frame).",
      "type": "boolean",
      "default": true,
      "group": "hardware"
    },
    {
      "key": "screwAccessSlotDiameter",
      "label": "Access slot diameter",
      "description": "Diameter of the screwdriver clearance slot through the brace. Size for the screwdriver shaft + a few mm clearance, not the screw head.",
      "type": "number",
      "default": 8,
      "min": 4,
      "max": 16,
      "step": 0.5,
      "group": "hardware",
      "unit": "mm"
    },
    {
      "key": "slottedWallHoles",
      "label": "Slotted wall holes",
      "description": "Elongate wall mounting holes vertically (along Z) for height adjustment when fitting to existing screws or levelling on uneven walls.",
      "type": "boolean",
      "default": false,
      "group": "hardware"
    },
    {
      "key": "slotOversizeMm",
      "label": "Extra slot length",
      "description": "Added vertical slot length (mm) beyond the bolt clearance diameter on the wall leg.",
      "type": "number",
      "default": 3,
      "min": 0.5,
      "max": 15,
      "step": 0.5,
      "group": "hardware",
      "unit": "mm"
    },
    {
      "key": "minHoleEdgeClearance",
      "label": "Minimum hole-to-edge",
      "description": "Keeps hole centres away from leg edges and from the brace, so holes cannot break out and screws cannot foul the brace web.",
      "type": "number",
      "default": 3,
      "min": 1.5,
      "max": 8,
      "step": 0.5,
      "group": "fit",
      "unit": "mm"
    },
    {
      "key": "xyHoleCompensation",
      "label": "XY hole compensation",
      "description": "Extra radius on holes for printer tolerance (subtract from nominal).",
      "type": "number",
      "default": 0.1,
      "min": 0,
      "max": 0.5,
      "step": 0.02,
      "group": "fit",
      "unit": "mm",
      "advanced": true
    }
  ],
  "preview": {
    "cameraPosition": [180, 110, 130],
    "target": [40, 6, 50]
  }
}
