{
  "id": "u-channel",
  "name": "U-channel bracket",
  "alternativeNames": "Channel bracket",
  "description": "Base with two flanges. Holes are in the flanges; length runs along X. Prints on the base (flat side down).",
  "thumbnail": "thumbnails/u-channel.png",
  "category": "channel",
  "version": "1.1.0",
  "generationStrategy": "uChannel",
  "units": "mm",
  "parameters": [
    {
      "key": "baseWidth",
      "label": "Base width",
      "description": "Outer width in Y (includes both flanges and the channel opening).",
      "type": "number",
      "default": 40,
      "min": 20,
      "max": 120,
      "step": 0.5,
      "group": "dimensions",
      "unit": "mm"
    },
    {
      "key": "leftFlangeHeight",
      "label": "Left flange height",
      "description": "Height of the left flange above the base (along Z).",
      "type": "number",
      "default": 20,
      "min": 8,
      "max": 80,
      "step": 0.5,
      "group": "dimensions",
      "unit": "mm"
    },
    {
      "key": "rightFlangeHeight",
      "label": "Right flange height",
      "description": "Height of the right flange above the base.",
      "type": "number",
      "default": 20,
      "min": 8,
      "max": 80,
      "step": 0.5,
      "group": "dimensions",
      "unit": "mm"
    },
    {
      "key": "thickness",
      "label": "Wall thickness",
      "description": "Thickness of base and flanges.",
      "type": "number",
      "default": 3,
      "min": 1.6,
      "max": 8,
      "step": 0.1,
      "group": "dimensions",
      "unit": "mm"
    },
    {
      "key": "length",
      "label": "Length",
      "description": "Extrusion length of the channel along X.",
      "type": "number",
      "default": 50,
      "min": 20,
      "max": 200,
      "step": 0.5,
      "group": "dimensions",
      "unit": "mm"
    },
    {
      "key": "holeDiameter",
      "label": "Hole diameter",
      "description": "Used when \"Custom\" bolt size is selected.",
      "type": "number",
      "default": 5.3,
      "min": 2,
      "max": 20,
      "step": 0.1,
      "group": "hardware",
      "unit": "mm"
    },
    {
      "key": "holesPerFlange",
      "label": "Holes per flange",
      "description": "Number of through-holes on each flange (same X positions on left and right).",
      "type": "integer",
      "default": 2,
      "min": 1,
      "max": 8,
      "group": "hardware"
    },
    {
      "key": "edgeOffset",
      "label": "End offset for holes",
      "description": "Inset from each end of the channel for the hole pattern along X.",
      "type": "number",
      "default": 8,
      "min": 2,
      "max": 40,
      "step": 0.5,
      "group": "hardware",
      "unit": "mm"
    },
    {
      "key": "countersunkHoles",
      "label": "Countersunk holes",
      "description": "Countersink on the outside of each flange (simplified).",
      "type": "boolean",
      "default": false,
      "group": "hardware"
    },
    {
      "key": "slottedHoles",
      "label": "Slotted holes",
      "description": "Vertical slots (along Z) for height adjustment on each flange.",
      "type": "boolean",
      "default": false,
      "group": "hardware"
    },
    {
      "key": "slotOversizeMm",
      "label": "Extra slot length",
      "description": "Additional vertical slot length.",
      "type": "number",
      "default": 2,
      "min": 0.5,
      "max": 15,
      "step": 0.5,
      "group": "hardware",
      "unit": "mm"
    },
    {
      "key": "minHoleEdgeClearance",
      "label": "Minimum hole-to-edge",
      "description": "Keeps flange holes away from channel ends.",
      "type": "number",
      "default": 2,
      "min": 0.5,
      "max": 10,
      "step": 0.5,
      "group": "fit",
      "unit": "mm"
    },
    {
      "key": "xyHoleCompensation",
      "label": "XY hole compensation",
      "description": "Extra printed hole radius.",
      "type": "number",
      "default": 0.1,
      "min": 0,
      "max": 0.5,
      "step": 0.02,
      "group": "fit",
      "unit": "mm",
      "advanced": true
    }
  ],
  "preview": {
    "cameraPosition": [80, 60, 50],
    "target": [25, 20, 15]
  }
}
